{
  "vendor": {
    "id": "hilan",
    "parserVersion": "1.0.0",
    "displayNameKey": "vendors.hilan"
  },
  "period": {
    "month": 4,
    "year": 2026,
    "label": "04/2026"
  },
  "earnings": [
    {
      "code": "933",
      "rawLabel": "933",
      "amount": 10,
      "category": "unknown",
      "sourceRegion": "earnings",
      "page": 1,
      "confidence": "low"
    },
    {
      "code": "001",
      "rawLabel": "001",
      "amount": 35000,
      "category": "earnings.base_salary",
      "sourceRegion": "earnings",
      "page": 1,
      "confidence": "high",
      "labelKey": "lines.baseSalary",
      "explanationKey": "explain.earnings.baseSalary",
      "quantity": 600,
      "unit": "hours",
      "rate": 35000
    },
    {
      "code": "002",
      "rawLabel": ".",
      "amount": 15000,
      "category": "earnings.role_supplement",
      "sourceRegion": "earnings",
      "page": 1,
      "confidence": "high",
      "labelKey": "lines.globalSupplement",
      "explanationKey": "explain.earnings.roleSupplement"
    },
    {
      "code": "100",
      "rawLabel": "100",
      "amount": 600,
      "category": "earnings.travel",
      "sourceRegion": "earnings",
      "page": 1,
      "confidence": "high",
      "labelKey": "lines.travel",
      "explanationKey": "explain.earnings.travel"
    },
    {
      "code": "107",
      "rawLabel": "107",
      "amount": 3,
      "category": "equity.rsu_vesting",
      "sourceRegion": "earnings",
      "page": 1,
      "confidence": "high",
      "labelKey": "lines.rsuVesting",
      "explanationKey": "explain.equity.rsuVesting",
      "isOneTime": true,
      "quantity": 3148.06,
      "unit": "hours",
      "rate": 3
    },
    {
      "code": "111",
      "rawLabel": "111",
      "amount": 274.73,
      "category": "equity.rsu_vesting",
      "sourceRegion": "earnings",
      "page": 1,
      "confidence": "high",
      "labelKey": "lines.rsuVestingSupplement",
      "explanationKey": "explain.equity.rsuVesting",
      "isOneTime": true,
      "quantity": 6868.25,
      "unit": "hours",
      "rate": 25
    },
    {
      "code": "497",
      "rawLabel": "497",
      "amount": 100,
      "category": "earnings.other",
      "sourceRegion": "earnings",
      "page": 1,
      "confidence": "high",
      "labelKey": "lines.paymentGrossUp",
      "explanationKey": "explain.earnings.grossUp"
    },
    {
      "code": "1160",
      "rawLabel": "espp",
      "amount": 0.15,
      "category": "equity.espp_purchase",
      "sourceRegion": "earnings",
      "page": 1,
      "confidence": "high",
      "labelKey": "lines.esppRate",
      "explanationKey": "explain.equity.esppRate"
    },
    {
      "code": "184",
      "rawLabel": ".",
      "amount": 14.5,
      "category": "earnings.other",
      "sourceRegion": "earnings",
      "page": 1,
      "confidence": "high",
      "labelKey": "lines.youthWage",
      "explanationKey": "explain.earnings.other"
    },
    {
      "code": "185",
      "rawLabel": "185",
      "amount": 100,
      "category": "unknown",
      "sourceRegion": "earnings",
      "page": 1,
      "confidence": "low"
    },
    {
      "code": "186",
      "rawLabel": "186",
      "amount": 1000,
      "category": "unknown",
      "sourceRegion": "earnings",
      "page": 1,
      "confidence": "low"
    },
    {
      "code": "1498",
      "rawLabel": "1498",
      "amount": 668.28,
      "category": "unknown",
      "sourceRegion": "earnings",
      "page": 1,
      "confidence": "low"
    },
    {
      "code": "4153",
      "rawLabel": "4153",
      "amount": 365,
      "category": "unknown",
      "sourceRegion": "earnings",
      "page": 1,
      "confidence": "low"
    }
  ],
  "deductions": [
    {
      "code": "INCOME_TAX",
      "rawLabel": "מס הכנסה",
      "labelKey": "lines.incomeTax",
      "amount": 17356,
      "category": "deduction.income_tax",
      "explanationKey": "explain.deduction.incomeTax",
      "sourceRegion": "summary",
      "page": 1,
      "confidence": "high"
    },
    {
      "code": "NI",
      "rawLabel": "ביטוח לאומי",
      "labelKey": "lines.nationalInsurance",
      "amount": 3175,
      "category": "deduction.national_insurance",
      "explanationKey": "explain.deduction.nationalInsurance",
      "sourceRegion": "summary",
      "page": 1,
      "confidence": "high"
    },
    {
      "code": "HEALTH",
      "rawLabel": "ביטוח בריאות",
      "labelKey": "lines.healthTax",
      "amount": 2534,
      "category": "deduction.health_tax",
      "explanationKey": "explain.deduction.healthTax",
      "sourceRegion": "summary",
      "page": 1,
      "confidence": "high"
    },
    {
      "code": "607",
      "rawLabel": "..",
      "amount": 28,
      "category": "deduction.other",
      "sourceRegion": "deductions",
      "page": 1,
      "confidence": "high",
      "labelKey": "lines.mealsDeduction",
      "explanationKey": "explain.deduction.meals",
      "quantity": 290.15,
      "unit": "hours",
      "rate": 28
    },
    {
      "code": "012",
      "rawLabel": ".-",
      "amount": 50000,
      "category": "deduction.pension_employee",
      "sourceRegion": "funds",
      "page": 1,
      "confidence": "high",
      "labelKey": "lines.pensionEmployee",
      "explanationKey": "explain.deduction.pension",
      "quantity": 3250,
      "unit": "hours",
      "rate": 6.5
    },
    {
      "code": "012",
      "rawLabel": "012",
      "amount": 50000,
      "category": "deduction.pension_employee",
      "sourceRegion": "funds",
      "page": 1,
      "confidence": "high",
      "labelKey": "lines.pensionEmployee",
      "explanationKey": "explain.deduction.pension",
      "quantity": 4165,
      "unit": "hours",
      "rate": 8.33
    },
    {
      "code": "205",
      "rawLabel": "205",
      "amount": 15712,
      "category": "deduction.keren_hishtalmut_employee",
      "sourceRegion": "funds",
      "page": 1,
      "confidence": "high",
      "labelKey": "lines.kerenHishtalmutEmployee",
      "explanationKey": "explain.deduction.kerenHishtalmut",
      "quantity": 1178.4,
      "unit": "hours",
      "rate": 7.5
    },
    {
      "code": "1660",
      "rawLabel": "espp",
      "amount": 7500,
      "category": "equity.espp_purchase",
      "sourceRegion": "deductions",
      "page": 1,
      "confidence": "high",
      "labelKey": "lines.esppDeduction",
      "explanationKey": "explain.equity.esppDeduction"
    }
  ],
  "totals": {
    "grossCash": 50714.5,
    "taxableGross": 50714.5,
    "netPay": 26730.51,
    "incomeTax": 17356,
    "ni": 3175,
    "healthTax": 2534,
    "totalEarnings": 60716.31,
    "totalDeductions": 33985.8,
    "pensionEmployee": 50000,
    "kerenHishtalmutEmployee": 15712
  },
  "context": {
    "creditPoints": 0,
    "equity": {
      "hasEquity": true,
      "rsuVesting": 3,
      "esppDeduction": 7500
    }
  },
  "flags": [
    "equity_vesting",
    "equity_espp",
    "unknown_line_items",
    "multi_page_ytd"
  ],
  "parseMeta": {
    "pageCount": 2,
    "amountTolerance": 0.01,
    "warnings": []
  }
}
