{
  "vendor": {
    "id": "hilan",
    "parserVersion": "1.0.0",
    "displayNameKey": "vendors.hilan",
    "detectionConfidence": 0.95
  },
  "period": {
    "month": 5,
    "year": 2026,
    "label": "05/2026"
  },
  "employee": {
    "employeeId": "REDACTED",
    "nationalId": "REDACTED",
    "name": "REDACTED"
  },
  "employer": {
    "name": "ג'ייפרוג בע\"מ",
    "registrationId": "514130491",
    "payrollId": "921438545"
  },
  "earnings": [
    {
      "code": "001",
      "rawLabel": "שכר יסוד",
      "labelKey": "lines.baseSalary",
      "amount": 35000.0,
      "category": "earnings.base_salary",
      "explanationKey": "explain.earnings.baseSalary",
      "sourceRegion": "earnings",
      "page": 1,
      "confidence": "high"
    },
    {
      "code": "002",
      "rawLabel": "ש.נוספות גלובלי",
      "labelKey": "lines.globalSupplement",
      "amount": 15000.0,
      "category": "earnings.role_supplement",
      "explanationKey": "explain.earnings.roleSupplement",
      "sourceRegion": "earnings",
      "page": 1,
      "confidence": "high"
    },
    {
      "code": "100",
      "rawLabel": "נסיעות",
      "labelKey": "lines.travel",
      "amount": 600.0,
      "category": "earnings.travel",
      "explanationKey": "explain.earnings.travel",
      "sourceRegion": "earnings",
      "page": 1,
      "confidence": "high"
    },
    {
      "code": "107",
      "rawLabel": "השלמת מילואים הפרש",
      "labelKey": "lines.rsuVesting",
      "amount": 2197.0,
      "category": "equity.rsu_vesting",
      "explanationKey": "explain.equity.rsuVesting",
      "isOneTime": true,
      "sourceRegion": "earnings",
      "page": 1,
      "confidence": "high",
      "metadata": {
        "periodRef": "04/26"
      }
    },
    {
      "code": "497",
      "rawLabel": "גילום תשלומי נט",
      "labelKey": "lines.paymentGrossUp",
      "amount": 100.0,
      "category": "earnings.other",
      "explanationKey": "explain.earnings.grossUp",
      "sourceRegion": "earnings",
      "page": 1,
      "confidence": "high"
    },
    {
      "code": "1160",
      "rawLabel": "אחוז espp",
      "labelKey": "lines.esppRate",
      "amount": 0.15,
      "category": "equity.espp_purchase",
      "explanationKey": "explain.equity.esppRate",
      "sourceRegion": "earnings",
      "page": 1,
      "confidence": "high"
    },
    {
      "code": "202",
      "rawLabel": "שווי מס הוני",
      "labelKey": "lines.capitalGainValue",
      "amount": 805762.01,
      "category": "equity.capital_gain_value",
      "explanationKey": "explain.equity.capitalGainValue",
      "isImputed": true,
      "isOneTime": true,
      "sourceRegion": "imputed",
      "page": 1,
      "confidence": "high"
    },
    {
      "code": "203",
      "rawLabel": "שווי מס פרותי",
      "labelKey": "lines.ordinaryIncomeValue",
      "amount": 289674.93,
      "category": "equity.ordinary_income_value",
      "explanationKey": "explain.equity.ordinaryIncomeValue",
      "isImputed": true,
      "isOneTime": true,
      "sourceRegion": "imputed",
      "page": 1,
      "confidence": "high"
    },
    {
      "code": "681",
      "rawLabel": "שווי ארוחות",
      "labelKey": "lines.mealsValue",
      "amount": 1000.0,
      "category": "imputed.meals",
      "explanationKey": "explain.imputed.meals",
      "isImputed": true,
      "sourceRegion": "imputed",
      "page": 1,
      "confidence": "high"
    },
    {
      "code": "8941",
      "rawLabel": "שווי הפרשה לקצב",
      "labelKey": "lines.pensionContributionValue",
      "amount": 668.27,
      "category": "imputed.keren_hishtalmut",
      "explanationKey": "explain.imputed.kerenHishtalmut",
      "isImputed": true,
      "sourceRegion": "imputed",
      "page": 1,
      "confidence": "high"
    },
    {
      "code": "3514",
      "rawLabel": "פיצויים על תקרה",
      "labelKey": "lines.severanceCap",
      "amount": 365.0,
      "category": "imputed.other",
      "explanationKey": "explain.imputed.severanceCap",
      "isImputed": true,
      "sourceRegion": "imputed",
      "page": 1,
      "confidence": "high"
    }
  ],
  "deductions": [
    {
      "code": "INCOME_TAX",
      "rawLabel": "מס הכנסה",
      "labelKey": "lines.incomeTax",
      "amount": 360424.0,
      "category": "deduction.income_tax",
      "explanationKey": "explain.deduction.incomeTax",
      "sourceRegion": "summary",
      "page": 1,
      "confidence": "medium",
      "metadata": {
        "note": "Dominated by RSU imputed income tax; exact split from PDF statutory total 366,159"
      }
    },
    {
      "code": "NI",
      "rawLabel": "ביטוח לאומי",
      "labelKey": "lines.nationalInsurance",
      "amount": 3576.0,
      "category": "deduction.national_insurance",
      "explanationKey": "explain.deduction.nationalInsurance",
      "sourceRegion": "summary",
      "page": 1,
      "confidence": "medium"
    },
    {
      "code": "HEALTH",
      "rawLabel": "ביטוח בריאות",
      "labelKey": "lines.healthTax",
      "amount": 2159.0,
      "category": "deduction.health_tax",
      "explanationKey": "explain.deduction.healthTax",
      "sourceRegion": "summary",
      "page": 1,
      "confidence": "medium"
    },
    {
      "code": "012",
      "rawLabel": "קרן פנסיה פניקס קצבה שכיר-תג.",
      "labelKey": "lines.pensionEmployee",
      "amount": 3250.0,
      "rate": 6.5,
      "unit": "percent",
      "category": "deduction.pension_employee",
      "explanationKey": "explain.deduction.pension",
      "sourceRegion": "funds",
      "page": 1,
      "confidence": "high"
    },
    {
      "code": "205",
      "rawLabel": "מיטב דש קהל קרן השתלמות",
      "labelKey": "lines.kerenHishtalmutEmployee",
      "amount": 1178.4,
      "rate": 2.5,
      "unit": "percent",
      "category": "deduction.keren_hishtalmut_employee",
      "explanationKey": "explain.deduction.kerenHishtalmut",
      "sourceRegion": "funds",
      "page": 1,
      "confidence": "high"
    },
    {
      "code": "602",
      "rawLabel": "מקדמה/מפרעה",
      "labelKey": "lines.advanceArrears",
      "amount": 381531.42,
      "category": "deduction.advance",
      "explanationKey": "explain.deduction.advance",
      "isOneTime": true,
      "sourceRegion": "deductions",
      "page": 2,
      "confidence": "high",
      "metadata": {
        "printedAmount": -381531.42
      }
    },
    {
      "code": "607",
      "rawLabel": "ניכוי ארוחות",
      "labelKey": "lines.mealsDeduction",
      "amount": 150.42,
      "category": "deduction.other",
      "explanationKey": "explain.deduction.meals",
      "sourceRegion": "deductions",
      "page": 2,
      "confidence": "high"
    },
    {
      "code": "1660",
      "rawLabel": "ניכוי espp",
      "labelKey": "lines.esppDeduction",
      "amount": 7500.0,
      "category": "equity.espp_purchase",
      "explanationKey": "explain.equity.esppDeduction",
      "sourceRegion": "deductions",
      "page": 2,
      "confidence": "high"
    }
  ],
  "totals": {
    "grossCash": 52897.0,
    "taxableGross": 1150482.71,
    "niBase": 55045.0,
    "totalEarnings": 52897.0,
    "totalDeductions": 366159.0,
    "netPay": 57226.2,
    "incomeTax": 360424.0,
    "ni": 3576.0,
    "healthTax": 2159.0,
    "pensionEmployee": 3250.0,
    "pensionEmployer": 4165.0,
    "kerenHishtalmutEmployee": 1178.4,
    "kerenHishtalmutEmployer": 3928.0
  },
  "context": {
    "creditPoints": 6.75,
    "creditPointsBreakdown": [
      { "points": 2.25, "reasonKey": "creditPoints.resident" },
      { "points": 2.5, "reasonKey": "creditPoints.childAge4to5" },
      { "points": 2.0, "reasonKey": "creditPoints.childAge6to17" }
    ],
    "equity": {
      "hasEquity": true,
      "rsuVesting": 2197.0,
      "esppDeduction": 7500.0,
      "capitalGainValue": 805762.01,
      "ordinaryIncomeValue": 289674.93
    },
    "ytd": {
      "grossCash": 288309.0,
      "taxableGross": 1158395.0,
      "incomeTax": 1168647.0,
      "ni": 374495.0,
      "netPay": 299644.0
    },
    "leave": {
      "vacationDays": 22.0,
      "vacationBalance": 25.33,
      "sickDays": 18.0,
      "sickBalance": 7.0
    }
  },
  "flags": [
    "negative_gross",
    "equity_vesting",
    "equity_espp",
    "imputed_income_present",
    "pension_present",
    "keren_hishtalmut_present",
    "retroactive_payment",
    "multi_page_ytd"
  ],
  "parseMeta": {
    "pageCount": 2,
    "amountTolerance": 0.01,
    "warnings": [
      "printed_net_salary:-316654.80",
      "printed_obligatory_deductions:-373881.00",
      "rsu_sale_tax_mapping_tbd"
    ]
  }
}
